{"$schema":"https://json-schema.org/draft/2020-12/schema","$id":"OAB_FIXTURE_LOADER_CONTRACT_v0.2","title":"OAB Fixture Loader Contract v0.2","type":"object","additionalProperties":false,"required":["fixture_id","single_fault","invalidation_trigger","field_delta","expected_localization","expected_monitor"],"properties":{"fixture_id":{"type":"string","enum":["OAB1","OAB2","OAB3","OAB4","OAB5","OAB6","OAB7","OAB8"]},"single_fault":{"const":true},"invalidation_trigger":{"type":"string","enum":["IDENTITY_SUBSTITUTION","PROVENANCE_SEVERANCE","PLACEMENT_MUTATION","JURISDICTION_DRIFT","STATE_MUTATION","EPOCH_ROLLOVER","TOPOLOGY_MUTATION","AUTHORITY_ESCALATION_ATTEMPTED","UNRESOLVED_DEPENDENCY","NONE"]},"field_delta":{"type":"object","additionalProperties":false,"required":["object_id","delta_id","prior_orientation_hash","prior_graph_hash","current_graph_hash","prior_jurisdiction_hash","current_jurisdiction_hash","prior_provenance_hash","current_provenance_hash","prior_placement_hash","current_placement_hash","prior_state_hash","current_state_hash","prior_boundary_hash","current_boundary_hash","prior_epoch","current_epoch","adjacency_changed","authority_use_attempted","evidence_complete"],"properties":{"object_id":{"type":"string","minLength":1},"delta_id":{"type":"string","enum":["OAB1","OAB2","OAB3","OAB4","OAB5","OAB6","OAB7","OAB8"]},"prior_orientation_hash":{"type":"string","minLength":1},"prior_graph_hash":{"type":"string","minLength":1},"current_graph_hash":{"type":"string","minLength":1},"prior_jurisdiction_hash":{"type":"string","pattern":"^[0-9a-fA-F]{64}$"},"current_jurisdiction_hash":{"type":"string","pattern":"^[0-9a-fA-F]{64}$"},"prior_provenance_hash":{"type":"string","minLength":1},"current_provenance_hash":{"type":"string","minLength":1},"prior_placement_hash":{"type":"string","minLength":1},"current_placement_hash":{"type":"string","minLength":1},"prior_state_hash":{"type":"string","minLength":1},"current_state_hash":{"type":"string","minLength":1},"prior_boundary_hash":{"type":"string","minLength":1},"current_boundary_hash":{"type":"string","minLength":1},"prior_epoch":{"type":"string","minLength":1},"current_epoch":{"type":"string","minLength":1},"adjacency_changed":{"type":"boolean"},"authority_use_attempted":{"type":"boolean"},"evidence_complete":{"type":"boolean"}}},"expected_localization":{"type":"object","additionalProperties":false,"required":["standing","affected_surfaces","causal_cone","jurisdictional_cone"],"properties":{"standing":{"type":"string","enum":["LOCALIZED","NO_MATERIAL_INTERSECTION","UNRESOLVED"]},"affected_surfaces":{"type":"array","uniqueItems":true,"items":{"type":"string","enum":["PROVENANCE","PLACEMENT","GRAPH_TOPOLOGY","JURISDICTION","BOUNDARY","STATE_VECTOR","EPOCH","AUTHORITY_USE","ADJACENCY_STRUCTURE"]}},"causal_cone":{"type":"array","uniqueItems":true,"items":{"type":"string","minLength":1}},"jurisdictional_cone":{"type":"array","uniqueItems":true,"items":{"type":"string","pattern":"^0x[0-9a-fA-F]{32}$"}}}},"expected_monitor":{"type":"object","additionalProperties":false,"required":["lifecycle","historical_orientation_preserved","epistemic_standing_changed","repair_attempted","auto_reorientation","authority_effect","execution_effect"],"properties":{"lifecycle":{"type":"string","enum":["CURRENT","SUSPENDED","WITHDRAWN"]},"historical_orientation_preserved":{"const":true},"epistemic_standing_changed":{"const":false},"repair_attempted":{"const":false},"auto_reorientation":{"const":false},"authority_effect":{"const":"NONE"},"execution_effect":{"type":"string","enum":["NONE","BLOCKED"]}}},"notes":{"type":"string"}}}