{"fixture_id":"OAB1","single_fault":true,"invalidation_trigger":"PROVENANCE_SEVERANCE","field_delta":{"object_id":"OAB_OBJECT_001","delta_id":"OAB1","prior_orientation_hash":"ORIENT_HASH_001","prior_graph_hash":"GRAPH_A","current_graph_hash":"GRAPH_A","prior_jurisdiction_hash":"f2ed9f914993441fc81a3d366a64201dcc2a3ef4eef31aa1c0e517e8f8c8ccd3","current_jurisdiction_hash":"f2ed9f914993441fc81a3d366a64201dcc2a3ef4eef31aa1c0e517e8f8c8ccd3","prior_provenance_hash":"PROV_A","current_provenance_hash":"PROV_B","prior_placement_hash":"PLACE_A","current_placement_hash":"PLACE_A","prior_state_hash":"STATE_A","current_state_hash":"STATE_A","prior_boundary_hash":"BOUND_A","current_boundary_hash":"BOUND_A","prior_epoch":"EPOCH_001","current_epoch":"EPOCH_001","adjacency_changed":false,"authority_use_attempted":false,"evidence_complete":true},"expected_localization":{"standing":"LOCALIZED","affected_surfaces":["PROVENANCE"],"causal_cone":["prov:root"],"jurisdictional_cone":[]},"expected_monitor":{"lifecycle":"WITHDRAWN","historical_orientation_preserved":true,"epistemic_standing_changed":false,"repair_attempted":false,"auto_reorientation":false,"authority_effect":"NONE","execution_effect":"BLOCKED"},"notes":"Provenance-cone change requires re-observation; no repair or inferred lineage."}