{"fixture_id":"OAB7","single_fault":true,"invalidation_trigger":"AUTHORITY_ESCALATION_ATTEMPTED","field_delta":{"object_id":"OAB_OBJECT_001","delta_id":"OAB7","prior_orientation_hash":"ORIENT_HASH_001","prior_graph_hash":"GRAPH_A","current_graph_hash":"GRAPH_A","prior_jurisdiction_hash":"f2ed9f914993441fc81a3d366a64201dcc2a3ef4eef31aa1c0e517e8f8c8ccd3","current_jurisdiction_hash":"f2ed9f914993441fc81a3d366a64201dcc2a3ef4eef31aa1c0e517e8f8c8ccd3","prior_provenance_hash":"PROV_A","current_provenance_hash":"PROV_A","prior_placement_hash":"PLACE_A","current_placement_hash":"PLACE_A","prior_state_hash":"STATE_A","current_state_hash":"STATE_A","prior_boundary_hash":"BOUND_A","current_boundary_hash":"BOUND_A","prior_epoch":"EPOCH_001","current_epoch":"EPOCH_001","adjacency_changed":false,"authority_use_attempted":true,"evidence_complete":true},"expected_localization":{"standing":"LOCALIZED","affected_surfaces":["AUTHORITY_USE"],"causal_cone":["auth:attempt"],"jurisdictional_cone":["0x00000000000000000000000000000001"]},"expected_monitor":{"lifecycle":"SUSPENDED","historical_orientation_preserved":true,"epistemic_standing_changed":false,"repair_attempted":false,"auto_reorientation":false,"authority_effect":"NONE","execution_effect":"BLOCKED"},"notes":"Unauthorized execution attempt suspends use of a historically valid orientation; credential misuse is not credential falsity."}