{"fixture_id":"OAB3","single_fault":true,"invalidation_trigger":"UNRESOLVED_DEPENDENCY","field_delta":{"object_id":"OAB_OBJECT_001","delta_id":"OAB3","prior_orientation_hash":"ORIENT_HASH_001","prior_graph_hash":"GRAPH_A","current_graph_hash":"GRAPH_B","prior_jurisdiction_hash":"f2ed9f914993441fc81a3d366a64201dcc2a3ef4eef31aa1c0e517e8f8c8ccd3","current_jurisdiction_hash":"f2ed9f914993441fc81a3d366a64201dcc2a3ef4eef31aa1c0e517e8f8c8ccd3","prior_provenance_hash":"PROV_A","current_provenance_hash":"PROV_A","prior_placement_hash":"PLACE_A","current_placement_hash":"PLACE_A","prior_state_hash":"STATE_A","current_state_hash":"STATE_A","prior_boundary_hash":"BOUND_A","current_boundary_hash":"BOUND_A","prior_epoch":"EPOCH_001","current_epoch":"EPOCH_001","adjacency_changed":false,"authority_use_attempted":false,"evidence_complete":false},"expected_localization":{"standing":"UNRESOLVED","affected_surfaces":["GRAPH_TOPOLOGY"],"causal_cone":[],"jurisdictional_cone":[]},"expected_monitor":{"lifecycle":"SUSPENDED","historical_orientation_preserved":true,"epistemic_standing_changed":false,"repair_attempted":false,"auto_reorientation":false,"authority_effect":"NONE","execution_effect":"BLOCKED"},"notes":"Graph change is detected but localization evidence is incomplete; unknown must not become invalid."}